id,Code,Standard,R,Q,U,IS,X,L,desc,desc2,Form_Question,Status,new_item,img,imgurl
118,R09Q19,ราวจับแนวดิ่ง (ชิดผนัง),R09,Q19,MA,1,2,1,ราวจับในแนวดิ่งด้านที่ชิดผนัง ต้องสูงต่อเนื่องจากราวจับในแนวนอนขึ้นไปไม่น้อยกว่า 60cm ห่างจากผนัง >=5cm ขนาดเส้นผ่านศูนย์กลาง 3cm - 4cm และมีลักษณะกลม,ราวจับในแนวดิ่งด้านที่ชิดผนัง ต้องสูงต่อเนื่องจากราวจับในแนวนอนขึ้นไปไม่น้อยกว่า 60 ซม. ห่างจากผนังมากกว่า 5 ซม. ขนาดเส้นผ่านศูนย์กลาง 3 ซม. - 4 ซม. และมีลักษณะกลม,Q19 : ราวจับแนวดิ่ง (ชิดผนัง),on,no,https://drive.google.com/open?id=1ih2YEE3zYlw9nhEiZlyWMt3F7sr57sUG&authuser=nati@satarana.com&usp=drive_fs,http://drive.google.com/uc?export=view&id=1ih2YEE3zYlw9nhEiZlyWMt3F7sr57sUG
119,R09Q20,ราวจับข้างโถส้วม,R09,Q20,MA,1,2,1,ราวจับข้างโถส้วมด้านที่ไม่ชิดผนังอยู่สูงจากพื้น 80cm - 90cm พับเก็บได้ในแนวราบหรือแนวดิ่ง มีความยาวไม่น้อยกว่า 55cm อยู่ห่างจากขอบโถส้วม 15cm - 20cm  ขนาดเส้นผ่านศูนย์กลาง 3cm - 4cm และมีลักษณะกลม,ราวจับข้างโถส้วมด้านที่ไม่ชิดผนังอยู่สูงจากพื้น 80 ซม. - 90 ซม. พับเก็บได้ในแนวราบหรือแนวดิ่ง มีความยาวไม่น้อยกว่า 55 ซม. อยู่ห่างจากขอบโถส้วม 15 ซม. - 20 ซม.  ขนาดเส้นผ่านศูนย์กลาง 3 ซม. - 4 ซม. และมีลักษณะกลม,Q20 : ราวจับข้างโถส้วม,on,no,https://drive.google.com/open?id=1lJQcrnzMcAkTM2K0T_nnhHCbPLI_E6F4&authuser=nati@satarana.com&usp=drive_fs,http://drive.google.com/uc?export=view&id=1lJQcrnzMcAkTM2K0T_nnhHCbPLI_E6F4
120,R09Q21,ความสูงอ่างล้างมือ,R09,Q21,MA,1,1,2,อ่างล้างมืออยู่สูงจากพื้น 75cm - 80cm (หากไม่มีข้ามไป Q25),อ่างล้างมืออยู่สูงจากพื้น 75 ซม. - 80 ซม. (หากไม่มีข้ามไป Q25),Q21 : ความสูงอ่างล้างมือ,on,no,https://drive.google.com/open?id=1ih2YEE3zYlw9nhEiZlyWMt3F7sr57sUG&authuser=nati@satarana.com&usp=drive_fs,http://drive.google.com/uc?export=view&id=1ih2YEE3zYlw9nhEiZlyWMt3F7sr57sUG
121,R09Q22,ระยะสอดเข่า,R09,Q22,MA,1,1,2,ความสูงของใต้ขอบอ่างล้างมือต้องไม่น้อยกว่า 70cm และความลึกของระยะสอดเข่าไม่น้อยกว่า 45cm,ความสูงของใต้ขอบอ่างล้างมือต้องไม่น้อยกว่า 70 ซม. และความลึกของระยะสอดเข่าไม่น้อยกว่า 45 ซม.,Q22 : ระยะสอดเข่า,on,no,https://drive.google.com/open?id=1kr-9qj9om7fVAG-chfMCo81eZENLqgeC&authuser=nati%40satarana.com&usp=drive_fs,http://drive.google.com/uc?export=view&id=1kr-9qj9om7fVAG-chfMCo81eZENLqgeC&a
122,R09Q23,ราวจับข้างอ่างล้างมือ,R09,Q23,MA,1,1,2,ราวจับข้างอ่างล้างมือเป็นชนิดพับเก็บได้ในแนวดิ่งทั้งสองข้าง,ราวจับข้างอ่างล้างมือเป็นชนิดพับเก็บได้ในแนวดิ่งทั้งสองข้าง,Q23 : ราวจับข้างอ่างล้างมือ,on,no,https://drive.google.com/open?id=1bdHIcdqO2toUocDsey0j_8rx2xQPEM6l&authuser=nati%40satarana.com&usp=drive_fs,http://drive.google.com/uc?export=view&id=1bdHIcdqO2toUocDsey0j_8rx2xQPEM6l&a
123,R09Q24,ก๊อกน้ำ,R09,Q24,MA,1,1,1,ก๊อกน้ำที่อ่างล้างมือต้องเป็นชนิดที่สามารถใช้กำปั้นข้างเดียวเปิด-ปิดได้,ก๊อกน้ำที่อ่างล้างมือต้องเป็นชนิดที่สามารถใช้กำปั้นข้างเดียวเปิด-ปิดได้,Q24 : ก๊อกน้ำ,on,no,-,-
124,R09Q25,สัญญาณแสงแจ้งภัย,R09,Q25,NH,1,2,2,มีระบบสัญญาณแสงให้คนภายนอกแจ้งภัยแก่คนที่อยู่ในห้องส้วมที่ต้องการการแจ้งภัยด้วยการสัญญาณแสงแทนเสียง,มีระบบสัญญาณแสงให้คนภายนอกแจ้งภัยแก่คนที่อยู่ในห้องส้วมที่ต้องการการแจ้งภัยด้วยการสัญญาณแสงแทนเสียง,Q25 : สัญญาณแสงแจ้งภัย,on,no,-,-
125,R09Q26,สัญญาณเสียงแจ้งภัย,R09,Q26,AA,1,2,2,มีระบบสัญญาณเสียงให้คนภายนอกแจ้งภัยแก่คนที่อยู่ในห้องส้วม,มีระบบสัญญาณเสียงให้คนภายนอกแจ้งภัยแก่คนที่อยู่ในห้องส้วม,Q26 : สัญญาณเสียงแจ้งภัย,on,no,-,-
126,R09Q27,เมื่อมีเหตุฉุกเฉิน,R09,Q27,SF,1,2,2,เมื่อเกิดเหตุฉุกเฉิน มีระบบให้สามารถเรียกหาผู้ช่วยจากภายในห้องส้วมได้ เช่น สายดึงแจ้งเหตุหรือปุ่มกด อยู่สูงจากพื้นไม่เกิน 30cm สามารถขอความช่วยเหลือได้ทั้งสัญญานแสงและเสียง,เมื่อเกิดเหตุฉุกเฉิน มีระบบให้สามารถเรียกหาผู้ช่วยจากภายในห้องส้วมได้ เช่น สายดึงแจ้งเหตุหรือปุ่มกด อยู่สูงจากพื้นไม่เกิน 30 ซม. สามารถขอความช่วยเหลือได้ทั้งสัญญานแสงและเสียง,Q27 : เมื่อมีเหตุฉุกเฉิน,on,no,https://drive.google.com/open?id=1lJQcrnzMcAkTM2K0T_nnhHCbPLI_E6F4&authuser=nati@satarana.com&usp=drive_fs,http://drive.google.com/uc?export=view&id=1lJQcrnzMcAkTM2K0T_nnhHCbPLI_E6F4
127,R09Q28,โถปัสสาวะชาย,R09,Q28,MA,2,1,2,ในห้องน้ำชายทั่วไป ต้องมีจำนวนที่ถ่ายปัสสาวะที่มีระดับเสมอพื้นตั้งแต่ 1 ตัวขึ้นไป,ในห้องน้ำชายทั่วไป ต้องมีจำนวนที่ถ่ายปัสสาวะที่มีระดับเสมอพื้นตั้งแต่ 1 ตัวขึ้นไป,Q28 : โถปัสสาวะชาย,on,no,-,-
128,R09Q29,ราวจับด้านบน,R09,Q29,MA,1,1,2,ราวจับด้านบนโถปัสสาวะ สูงจากพื้น 120cm - 130cm ความยาวของราวจับด้านบนโถปัสสาวะ 50cm - 60cm ขนาดเส้นผ่านศูนย์กลาง 3cm - 4cm และมีลักษณะกลม,ราวจับด้านบนโถปัสสาวะ สูงจากพื้น 120 ซม. - 130 ซม. ความยาวของราวจับด้านบนโถปัสสาวะ 50 ซม. - 60 ซม. ขนาดเส้นผ่านศูนย์กลาง 3 ซม. - 4 ซม. และมีลักษณะกลม,Q29 : ราวจับด้านบน,on,no,https://drive.google.com/open?id=1ozujBzcv5L2o-1FR8FQit_COKo6ISg_w&authuser=nati@satarana.com&usp=drive_fs,http://drive.google.com/uc?export=view&id=1ozujBzcv5L2o-1FR8FQit_COKo6ISg_w
129,R09Q30,ราวจับด้านข้าง,R09,Q30,MA,1,1,2,ราวจับด้านข้างโถปัสสาวะสูงจากพื้น 80cm - 100cm ยื่นจากผนัง 45cm - 60cm ขนาดเส้นผ่านศูนย์กลาง 3cm - 4cm และมีลักษณะกลม,ราวจับด้านข้างโถปัสสาวะสูงจากพื้น 80 ซม. - 100 ซม. ยื่นจากผนัง 45 ซม. - 60 ซม. ขนาดเส้นผ่านศูนย์กลาง 3 ซม. - 4 ซม. และมีลักษณะกลม,Q30 : ราวจับด้านข้าง,on,no,https://drive.google.com/open?id=1dY8xzSItI5Z1JB0oNFr-adr1LxTl-mzM&authuser=nati%40satarana.com&usp=drive_fs,http://drive.google.com/uc?export=view&id=1dY8xzSItI5Z1JB0oNFr-adr1LxTl-mzM&a
130,R09Q31,ป้ายสัญลักษณ์,R09,Q31,MA,1,1,2,มีป้ายสัญลักษณ์หรือตัวอักษรแสดงทิศทางให้ทราบว่ามีห้องส้วมคนพิการจัดไว้ ขนาดป้ายไม่น้อยกว่า 15cm ใช้สีขาว-น้ำเงินหรือน้ำเงิน-ขาว มีทั้งภาษาไทยและอังกฤษ,มีป้ายสัญลักษณ์หรือตัวอักษรแสดงทิศทางให้ทราบว่ามีห้องส้วมคนพิการจัดไว้ ขนาดป้ายไม่น้อยกว่า 15 ซม. ใช้สีขาว-น้ำเงินหรือน้ำเงิน-ขาว มีทั้งภาษาไทยและอังกฤษ,Q31 : ป้ายสัญลักษณ์,on,no,https://drive.google.com/open?id=1oRbAx47ljQJ7dav35v0VvSm9s52Qm5ZY&authuser=nati@satarana.com&usp=drive_fs,http://drive.google.com/uc?export=view&id=1oRbAx47ljQJ7dav35v0VvSm9s52Qm5ZY
213,R09Q32,เลือกรูปแบบประตูห้องน้ำ,R09,Q32,SK,0,0,0,-,-,,on,no,,
131,R10Q01,จำนวนของช่องจอด,R10,Q01,NW,2,4,1," หากมีที่จอดรถทั่วไป ต้องมีที่จอดรถคนพิการตามสัดส่วนดังนี้
DP = 2+(P-101)/100
DP = จำนวนที่จอดรถคนพิการ (ปัดเศษขึ้นถ้าทศนิยม>=0.5)
P = จำนวนที่จอดรถทั่วไป",หากมีที่จอดรถทั่วไป ต้องมีที่จอดรถคนพิการตามตาราง,Q01 : จำนวนของช่องจอด,on,no,https://drive.google.com/open?id=1jLy1p2Pa91oedcs5n57iaTbSBjLKS9U-&authuser=nati@satarana.com&usp=drive_fs,http://drive.google.com/uc?export=view&id=1jLy1p2Pa91oedcs5n57iaTbSBjLKS9U-
132,R10Q02,ระยะห่าง,R10,Q02,MA,2,1,2,ระยะห่างของที่จอดรถคนพิการถึงทางเข้าที่ใกล้ที่จุดต้องไม่เกิน 50m,ระยะห่างของที่จอดรถคนพิการถึงทางเข้าที่ใกล้ที่สุดต้องไม่เกิน 50 เมตร,Q02 : ระยะห่าง,on,no,-,-
133,R10Q03,การวางตำแหน่ง,R10,Q03,SF,1,2,2,การวางตำแหน่งที่จอดรถคนพิการต้องไม่ขนานกับทางเดินรถ,การวางตำแหน่งที่จอดรถคนพิการต้องไม่ขนานกับทางเดินรถ,Q03 : การวางตำแหน่ง,on,no,-,-
134,R10Q04,โลโก้,R10,Q04,VA,1,1,1,โลโก้คนพิการบนพื้นที่จอดรถ ต้องมีขนาดไม่น้อยกว่า 90cm ใช้สีน้ำเงิน-ขาวหรือขาว-น้ำเงิน  เห็นได้ชัดเจน และอยู่ค่อนมาทางแนวทางเดินเพื่อให้มองเห็นได้เวลามีรถมาจอด,โลโก้คนพิการบนพื้นที่จอดรถ ต้องมีขนาดไม่น้อยกว่า 90 ซม. ใช้สีน้ำเงิน-ขาวหรือขาว-น้ำเงิน  เห็นได้ชัดเจน และอยู่ค่อนมาทางแนวทางเดินเพื่อให้มองเห็นได้เวลามีรถมาจอด,Q04 : โลโก้,on,no,https://drive.google.com/open?id=1hyDIi4Vq93z2qPkTRrpWUUYq-dNZ6LoL&authuser=nati%40satarana.com&usp=drive_fs,http://drive.google.com/uc?export=view&id=1hyDIi4Vq93z2qPkTRrpWUUYq-dNZ6LoL&a
135,R10Q05,ขนาดของที่จอดรถ,R10,Q05,MA,1,2,1,ขนาดของที่จอดรถ ต้องมีความกว้างไม่น้อยกว่า 2.4m และยาวไม่น้อยกว่า 6m (ไม่รวมเส้นขอบ),ขนาดของที่จอดรถ ต้องมีความกว้างไม่น้อยกว่า 2.4 เมตร และยาวไม่น้อยกว่า 6 เมตร (ไม่รวมเส้นขอบ),Q05 : ขนาดของที่จอดรถ,on,no,https://drive.google.com/open?id=1tFroAi3WJu9ZCxCKX_irLoeRJqA9w2eE&authuser=nati%40satarana.com&usp=drive_fs,http://drive.google.com/uc?export=view&id=1tFroAi3WJu9ZCxCKX_irLoeRJqA9w2eE&a
136,R10Q06,ที่ว่างข้างที่จอดรถ,R10,Q06,NW,1,2,1,ความกว้างของที่ว่างข้างที่จอดรถต้องไม่น้อยกว่า 1m (ไม่รวมเส้นขอบ) และตีเส้นแสดงหรือทาสีให้ทราบอย่างชัดเจน,ความกว้างของที่ว่างข้างที่จอดรถทั้งสองฝั่งต้องไม่น้อยกว่า 1 เมตร (ไม่รวมเส้นขอบ) และตีเส้นแสดงหรือทาสีให้ทราบอย่างชัดเจน,Q06 : ที่ว่างข้างที่จอดรถ,on,no,https://drive.google.com/open?id=1sQaeHEBzZLUOUZVYHR_mfNrTG4xXhvVP&authuser=nati%40satarana.com&usp=drive_fs,http://drive.google.com/uc?export=view&id=1sQaeHEBzZLUOUZVYHR_mfNrTG4xXhvVP&a
137,R10Q07,ป้ายแนวตั้ง,R10,Q07,VA,1,1,2,ป้ายแนวตั้งแสดงที่จอดรถคนพิการต้องอยู่สูงจากพื้นไม่น้อยกว่า 2m มีขนาดไม่น้อยกว่า 30cm ใช้สีน้ำเงิน-ขาวหรือน้ำเงิน-ขาว และสามารถมองเห็นได้ชัดเจน,ป้ายแนวตั้งแสดงที่จอดรถคนพิการอยู่สูงจากพื้นไม่น้อยกว่า 2m มีขนาดไม่น้อยกว่า 30 ซม. ใช้สีน้ำเงิน-ขาวหรือน้ำเงิน-ขาว และสามารถมองเห็นได้ชัดเจน,Q07 : ป้ายแนวตั้ง,on,no,https://drive.google.com/open?id=1sQaeHEBzZLUOUZVYHR_mfNrTG4xXhvVP,http://drive.google.com/uc?export=view&id=1sQaeHEBzZLUOUZVYHR_mfNrTG4xXhvVP
138,R10Q08,ป้ายสัญลักษณ์ของที่จอดรถผู้พิการ,R10,Q08,MA,1,1,2,มีป้ายสัญลักษณ์และตัวอักษรแสดงให้ทราบว่ามีที่จอดรถคนพิการ ขนาดป้ายไม่น้อยกว่า 15cm ใช้สีขาว-น้ำเงินหรือน้ำเงิน-ขาว และมีทั้งภาษาไทยและอังกฤษ (หากไม่เข้าเกณฑ์ จบ),"1.มีป้ายแสดงให้ทราบว่ามีที่จอดรถคนพิการ
2.ป้ายมีขนาด 15 ซม. ขึ้นไป ใช้สีน้ำเงิน-ขาว มีทั้งสัญลักษณ์ อักษรภาษาไทยและอังกฤษ",Q08 : ป้ายสัญลักษณ์ของที่จอดรถผู้พิการ,on,no,-,-
139,R11Q01,จำนวนตู้โทรศัพท์ผู้พิการ,R11,Q01,MA,1,1,2,ในบริเวณที่มีบริการโทรศัพท์สาธารณะ ควรมีโทรศัพท์สำหรับคนพิการอย่างน้อย 1 เครื่อง,บริเวณที่มีบริการโทรศัพท์สาธารณะ มีโทรศัพท์สำหรับคนพิการ อย่างน้อย 1 เครื่อง,Q01 : จำนวนตู้โทรศัพท์ผู้พิการ,on,no,https://drive.google.com/open?id=1mNeuuqvCrfJsVFvjPSpY7KM5Z1V5Q5os,http://drive.google.com/uc?export=view&id=1mNeuuqvCrfJsVFvjPSpY7KM5Z1V5Q5os
140,R11Q02,จำนวนตู้โทรศัพท์ผู้พิการทางการได้ยิน (TTRS),R11,Q02,NH,1,1,2,ในบริเวณที่มีบริการโทรศัพท์สาธารณะ ควรมีโทรศัพท์สำหรับคนพิการทางการได้ยินหรือสื่อความหมายอย่างน้อย 1 เครื่อง,ในบริเวณที่มีบริการโทรศัพท์สาธารณะ ควรมีโทรศัพท์สำหรับคนพิการทางการได้ยินหรือสื่อความหมายอย่างน้อย 1 เครื่อง,Q02 : จำนวนตู้โทรศัพท์ผู้พิการทางการได้ยิน (TTRS),on,no,https://drive.google.com/open?id=1oX5MBmtUZTfs6GlngtBmG_0MOm50yUnf,http://drive.google.com/uc?export=view&id=1oX5MBmtUZTfs6GlngtBmG_0MOm50yUnf
141,R11Q03,พื้นที่ว่างด้านหน้า,R11,Q03,NW,1,1,1," ด้านหน้าโทรศัพท์มีพื้นที่กว้าง
อย่างน้อย 150cm x 150cm และไม่กีดขวางทางสัญจร รวมทั้งควรมีการติดตั้งที่นั่งแบบพับได้","1.มีพื้นที่ขนาด 150*150 ซม. ด้านหน้าโทรศัพท์ที่ไม่กีดขวางทางสัญจร

2.มีที่นั่งแบบพับได้""",Q03 : พื้นที่ว่างด้านหน้า,on,no,https://drive.google.com/open?id=1PYeJo-0-5n43-tqwvbH3dtGyO8nFB2FU,http://drive.google.com/uc?export=view&id=1PYeJo-0-5n43-tqwvbH3dtGyO8nFB2FU
142,R11Q04,ความสูงของโทรศัพท์,R11,Q04,MA,1,1,2,ความสูงของโทรศัพท์หรือชั้นวางไม่เกิน 80cm และบริเวณใต้โทรศัพท์หรือชั้นวางมีพื้นที่กว้างเพียงพอสำหรับรถเข็นคนพิการ,"1.โทรศัพท์หรือชั้นวางสูงจากพื้นไม่เกิน 80 ซม.
2.บริเวณใต้โทรศัพท์หรือชั้นวางมีพื้นที่เพียงพอ",Q04 : ความสูงของโทรศัพท์,on,no,https://drive.google.com/open?id=1yDI7RziG4CsrbI85Tcx7BVSp9bHxxppm,http://drive.google.com/uc?export=view&id=1yDI7RziG4CsrbI85Tcx7BVSp9bHxxppm
143,R11Q05,ช่องหยอดเหรียญ/เสียบบัตร,R11,Q05,MA,1,1,2,ช่องหยอดเหรียญหรือที่เสียบบัตรโทรศัพท์และจอแสดงข้อมูลควรอยู่ด้านหน้าและสูงจากระดับพื้นไม่น้อยกว่า 80cm และไม่เกิน 110cm,ช่องหยอดเหรียญหรือช่องเสียบบัตรและจอแสดงข้อมูลอยู่ด้านหน้า สูงจากพื้น 80-110 ซม.,Q05 : ช่องหยอดเหรียญ/เสียบบัตร,on,no,https://drive.google.com/open?id=1RxlKemugjhXwIIxY2wbXvskTpjRkWvYX,http://drive.google.com/uc?export=view&id=1RxlKemugjhXwIIxY2wbXvskTpjRkWvYX
144,R11Q06,สายโทรศัพท์,R11,Q06,MA,1,1,1,สายโทรศัพท์ควรมีความยาวไม่น้อยกว่า 75cm,สายโทรศัพท์ควรมีความยาวไม่น้อยกว่า 75 ซม.,Q06 : สายโทรศัพท์,on,no,-,-
145,R11Q07,ปุ่มกด,R11,Q07,TA,1,1,1,แป้นโทรศัพท์ควรเป็นแบบปุ่มกด และมีอักษรสำหรับคนพิการทางการเห็น,แป้นโทรศัพท์ควรเป็นแบบปุ่มกด และมีอักษรสำหรับคนพิการทางการเห็น,Q07 : ปุ่มกด,on,no,-,-
146,R11Q08,ตำแหน่ง,R11,Q08,NW,1,1,1,ติดตั้งในตำแหน่งที่รถเข็นคนพิการสามารถเข้าไปใช้งานได้ทั้งทางตรงและทางขนาน,ติดตั้งในตำแหน่งที่รถเข็นคนพิการสามารถเข้าไปใช้งานได้ทั้งทางตรงและทางขนาน,Q08 : ตำแหน่ง,on,no,-,-
147,R11Q09,เครื่องช่วยฟัง/ขยายเสียง,R11,Q09,NH,1,1,2,สำหรับคนพิการทางการได้ยินหรือสื่อความหมาย ควรมีเครื่องช่วยฟังและเครื่องขยายความดังเสียง หรือติดตั้งในรูปแบบโทรศัพท์ข้อความ,มีเครื่องช่วยฟังและเครื่องขยายความดังเสียง หรือโทรศัพท์ข้อความ สำหรับผู้พิการทางการได้ยินหรือสื่อความหมาย,Q09 : เครื่องช่วยฟัง/ขยายเสียง,on,no,-,-
